{
  "type": "object",
  "properties": {
    "schemaVersion": {
      "const": 1
    },
    "id": {
      "type": "string",
      "pattern": "^[a-z][a-z0-9-]{0,63}$"
    },
    "version": {
      "type": "integer",
      "minimum": 1
    },
    "knowledge": {
      "type": "array",
      "items": {
        "$ref": "#/$defs/knowledge"
      }
    },
    "units": {
      "type": "array",
      "items": {
        "$ref": "#/$defs/unit"
      }
    },
    "paths": {
      "type": "array",
      "items": {
        "$ref": "#/$defs/path"
      }
    },
    "assets": {
      "type": "array",
      "items": {
        "$ref": "#/$defs/asset"
      }
    }
  },
  "required": [
    "schemaVersion",
    "id",
    "version",
    "knowledge",
    "units",
    "paths",
    "assets"
  ],
  "additionalProperties": false,
  "$schema": "https://json-schema.org/draft/2020-12/schema",
  "$id": "https://math-master.local/schemas/content-package.schema.json",
  "$defs": {
    "ref": {
      "type": "object",
      "properties": {
        "id": {
          "type": "string",
          "pattern": "^[a-z][a-z0-9-]{0,63}$"
        },
        "version": {
          "type": "integer",
          "minimum": 1
        }
      },
      "required": [
        "id",
        "version"
      ],
      "additionalProperties": false
    },
    "source": {
      "type": "object",
      "properties": {
        "kind": {
          "enum": [
            "original",
            "external"
          ]
        },
        "author": {
          "type": "string"
        },
        "title": {
          "type": "string"
        },
        "url": {
          "type": "string"
        },
        "accessedAt": {
          "type": "string"
        },
        "license": {
          "type": "string"
        },
        "attribution": {
          "type": "string"
        }
      },
      "required": [
        "kind",
        "author",
        "title",
        "url",
        "accessedAt",
        "license",
        "attribution"
      ],
      "additionalProperties": false
    },
    "relation": {
      "type": "object",
      "properties": {
        "kind": {
          "enum": [
            "prerequisite",
            "derivation",
            "related"
          ]
        },
        "target": {
          "$ref": "#/$defs/ref"
        }
      },
      "required": [
        "kind",
        "target"
      ],
      "additionalProperties": false
    },
    "knowledge": {
      "type": "object",
      "properties": {
        "id": {
          "type": "string",
          "pattern": "^[a-z][a-z0-9-]{0,63}$"
        },
        "version": {
          "type": "integer",
          "minimum": 1
        },
        "domainIds": {
          "type": "array",
          "items": {
            "type": "string",
            "pattern": "^[a-z][a-z0-9-]{0,63}$"
          }
        },
        "topicIds": {
          "type": "array",
          "items": {
            "type": "string",
            "pattern": "^[a-z][a-z0-9-]{0,63}$"
          }
        },
        "type": {
          "enum": [
            "concept",
            "definition",
            "axiom",
            "theorem",
            "corollary",
            "method",
            "mathematical-thinking"
          ]
        },
        "title": {
          "type": "string"
        },
        "titleZh": {
          "type": "string"
        },
        "statement": {
          "type": "string"
        },
        "scope": {
          "type": "string"
        },
        "system": {
          "type": "string"
        },
        "proof": {
          "type": "string"
        },
        "objectives": {
          "type": "array",
          "items": {
            "type": "string"
          }
        },
        "conditions": {
          "type": "array",
          "items": {
            "type": "string"
          }
        },
        "sources": {
          "type": "array",
          "items": {
            "$ref": "#/$defs/source"
          }
        },
        "relations": {
          "type": "array",
          "items": {
            "$ref": "#/$defs/relation"
          }
        }
      },
      "required": [
        "id",
        "version",
        "domainIds",
        "topicIds",
        "type",
        "title",
        "titleZh",
        "statement",
        "scope",
        "system",
        "proof",
        "objectives",
        "conditions",
        "sources",
        "relations"
      ],
      "additionalProperties": false
    },
    "angle": {
      "type": "object",
      "properties": {
        "kind": {
          "type": "string"
        },
        "body": {
          "type": "string"
        }
      },
      "required": [
        "kind",
        "body"
      ],
      "additionalProperties": false
    },
    "unit": {
      "type": "object",
      "properties": {
        "id": {
          "type": "string",
          "pattern": "^[a-z][a-z0-9-]{0,63}$"
        },
        "version": {
          "type": "integer",
          "minimum": 1
        },
        "knowledge": {
          "$ref": "#/$defs/ref"
        },
        "angles": {
          "type": "array",
          "items": {
            "$ref": "#/$defs/angle"
          }
        },
        "examples": {
          "type": "array",
          "items": {
            "type": "string"
          }
        },
        "counterexamples": {
          "type": "array",
          "items": {
            "type": "string"
          }
        },
        "assetIds": {
          "type": "array",
          "items": {
            "type": "string",
            "pattern": "^[a-z][a-z0-9-]{0,63}$"
          }
        }
      },
      "required": [
        "id",
        "version",
        "knowledge",
        "angles",
        "examples",
        "counterexamples",
        "assetIds"
      ],
      "additionalProperties": false
    },
    "path": {
      "type": "object",
      "properties": {
        "id": {
          "type": "string",
          "pattern": "^[a-z][a-z0-9-]{0,63}$"
        },
        "version": {
          "type": "integer",
          "minimum": 1
        },
        "domainIds": {
          "type": "array",
          "items": {
            "type": "string",
            "pattern": "^[a-z][a-z0-9-]{0,63}$"
          }
        },
        "title": {
          "type": "string"
        },
        "titleZh": {
          "type": "string"
        },
        "nodes": {
          "type": "array",
          "items": {
            "$ref": "#/$defs/ref"
          }
        }
      },
      "required": [
        "id",
        "version",
        "domainIds",
        "title",
        "titleZh",
        "nodes"
      ],
      "additionalProperties": false
    },
    "asset": {
      "type": "object",
      "properties": {
        "id": {
          "type": "string",
          "pattern": "^[a-z][a-z0-9-]{0,63}$"
        },
        "path": {
          "type": "string"
        },
        "sha256": {
          "type": "string",
          "pattern": "^[a-f0-9]{64}$"
        },
        "author": {
          "type": "string"
        },
        "license": {
          "type": "string"
        },
        "attribution": {
          "type": "string"
        },
        "knowledge": {
          "$ref": "#/$defs/ref"
        }
      },
      "required": [
        "id",
        "path",
        "sha256",
        "author",
        "license",
        "attribution",
        "knowledge"
      ],
      "additionalProperties": false
    }
  }
}
